<?xml version="1.0" encoding="UTF-8"?>
<xsd:schema xmlns:xsd="http://www.w3.org/2001/XMLSchema">
    <xsd:element name="listaPrenotazioni">
        <xsd:complexType>
            <xsd:sequence>
                <xsd:sequence>
                    <xsd:element ref="prenotazione" minOccurs="0" maxOccurs="unbounded" />
                </xsd:sequence>
            </xsd:sequence>
        </xsd:complexType>
    </xsd:element>

    <xsd:element name="prenotazione">
        <xsd:complexType>
            <xsd:sequence>
                <xsd:element ref="codFisc" minOccurs="1" maxOccurs="1" />
                <xsd:element ref="data" minOccurs="1" maxOccurs="1" />
                <xsd:element ref="ora" minOccurs="1" maxOccurs="1" />
                <xsd:element ref="richieste" minOccurs="0" maxOccurs="1" />
                <xsd:element ref="prezzoTotale" minOccurs="1" maxOccurs="1" />
                <xsd:element ref="creditiUsati" minOccurs="1" maxOccurs="1" />
                <xsd:element ref="listaPortate" minOccurs="1" maxOccurs="1" />
            </xsd:sequence>
            <xsd:attribute name="id" type="xsd:ID" use="required" />
        </xsd:complexType>
    </xsd:element>

    <xsd:element name="codFisc" type="xsd:string" />
    <xsd:element name="data" type="xsd:date" />
    <xsd:element name="ora" type="xsd:time" />
    <xsd:element name="richieste" type="xsd:string" />
    <xsd:element name="prezzoTotale">
        <xsd:simpleType>
            <xsd:restriction base="xsd:int">
                <xsd:minExclusive value="0" />
            </xsd:restriction>
        </xsd:simpleType>
    </xsd:element>

    <xsd:element name="creditiUsati">
        <xsd:simpleType>
            <xsd:restriction base="xsd:int">
                <xsd:minInclusive value="0" />
            </xsd:restriction>
        </xsd:simpleType>
    </xsd:element>

    <xsd:element name="listaPortate">
        <xsd:complexType>
            <xsd:sequence>
                <xsd:element ref="portata" minOccurs="1" maxOccurs="unbounded" />
            </xsd:sequence>
        </xsd:complexType>
    </xsd:element>

    <xsd:element name="portata">
        <xsd:complexType>
            <xsd:sequence>
                <xsd:element ref="nome" minOccurs="1" maxOccurs="1" />
                <xsd:element ref="quantita" minOccurs="1" maxOccurs="1" />
            </xsd:sequence>
        </xsd:complexType>
    </xsd:element>

    <xsd:element name="nome" type="xsd:string" />
    <xsd:element name="quantita">
        <xsd:simpleType>
            <xsd:restriction base="xsd:int">
                <xsd:minInclusive value="1" />
            </xsd:restriction>
        </xsd:simpleType>
    </xsd:element>
</xsd:schema>
